{
  "definitions": {},
  "$schema": "http://json-schema.org/draft-07/schema#",
  "$id": "http://example.com/root.json",
  "type": "object",
  "title": "The Root Schema",
  "required": [
    "felles",
    "variantType",
    "død",
    "behandlingsfristUker",
    "antallBarn"
  ],
  "properties": {
    "felles": {
      "type": "object"
    },
    "variantType": {
      "type": "string"
    },
    "død": {
      "type": "boolean"
    },
    "behandlingsfristUker": {
      "type": "number"
    },
    "antallBarn": {
      "type": "number"
    }
  }
}
