{
  "felles": {
    "søkerNavn": "Dolly Duck",
    "søkerPersonnummer": "300220 12345",
    "fritekst": "FRITEKST",
    "brevDato": "4. april 2020",
    "erKopi": false,
    "harVerge": false,
    "saksnummer": "123456789",
    "ytelseType": "ES",
    "behandlesAvKA": false,
    "erUtkast": false
  },
  "variantType": "FORLENGET",
  "død": false,
  "behandlingsfristUker": 5,
  "antallBarn": 1
}